{
  "schemaVersion": 1,
  "id": "robo_pals",
  "version": "1.0.0",
  "name": "Robo Pals",
  "description": "A friendly boxy robot with a little robot dance and a charging pad.",
  "author": { "name": "Example Author", "url": "https://example.com/robo-pals" },
  "license": "CC-BY-4.0",
  "engineVersion": "^0.1.0",
  "catalogVersion": "1",
  "testedWith": "1-2f7e7addb9",
  "audience": ["kids", "general"],
  "tags": ["robot", "friendly"],
  "files": [
    { "path": "characters/bodies.json", "sha256": "sha256-0315b3aaf1d584448d1f7c0de21cdfb9a5eb0e69c79e66a182f60592c033472e" },
    { "path": "characters/presets/bolt.json", "sha256": "sha256-4c9610446866fd576dfbf878596419712e305e1b8c11daaba1a14fbf85b2658c" },
    { "path": "examples/index.json", "sha256": "sha256-9ef1dee8b923344a90c4bbd26623fd8218a8907e719ee458f6fb0b5f65cab020" },
    { "path": "examples/stories/bolt_dances.json", "sha256": "sha256-2910b9a51c8d9a91d2af15b9e121311883457c0dd8d7994d17d47b480c408d52" },
    { "path": "moves/emotes.json", "sha256": "sha256-80a2133acc184b316ba6f0ce15992ce2ff93e27da5491bed2c37c35165e8e886" },
    { "path": "moves/poses.json", "sha256": "sha256-2a352f148ba606944896c5d04460b0f0e55d5d67da38b234d663958dc7dccfb1" },
    { "path": "world/objects.json", "sha256": "sha256-5d5c7840aebb838f42c1076d7c55de6615655f4d540cf9cacb3ff1d28b6d1f6a" }
  ],
  "contentHash": "sha256-1f159a947bd00c7ecd7d157e5855f81a9c2b18aa874be5e87c7d76adf7203789"
}
